"_SYSTEM_ID","Question External Id","Question Name"
"656ed702e9b03d554c1069d1","SUR_TEST_001_1701762813833","Enter your First question"
"656ed702e9b03d554c1069d7","SUR_TEST_002_1701762813833","Enter your Second question"
"656ed702e9b03d554c1069dd","SUR_TEST_003_1701762813833","Are you planning to come back?"
"656ed702e9b03d554c1069e4","SUR_TEST_004_1701762813833","What type of device is available at home?"
"656ed702e9b03d554c1069ea","SUR_TEST_005_1701762813833","Does the child have a quiet place to study?"
"656ed702e9b03d554c1069f0","SUR_TEST_006_1701762813833","Were you able to enroll your child in courses on Diksha?"
"656ed702e9b03d554c1069f7","SUR_TEST_007_1701762813833","What are the challenges that you are facing in enrolment?"