"_SYSTEM_ID","Question External Id","Question Name"
"656deb53e9b03d554c1067a4","SUR_TEST_001_1701702476752","Enter your First question"
"656deb53e9b03d554c1067aa","SUR_TEST_002_1701702476752","Enter your Second question"
"656deb53e9b03d554c1067b0","SUR_TEST_003_1701702476752","Are you planning to come back?"
"656deb53e9b03d554c1067b7","SUR_TEST_004_1701702476752","What type of device is available at home?"
"656deb53e9b03d554c1067bd","SUR_TEST_005_1701702476752","Does the child have a quiet place to study?"
"656deb53e9b03d554c1067c3","SUR_TEST_006_1701702476752","Were you able to enroll your child in courses on Diksha?"
"656deb53e9b03d554c1067ca","SUR_TEST_007_1701702476752","What are the challenges that you are facing in enrolment?"