"_SYSTEM_ID","Question External Id","Question Name"
"656de976e9b03d554c1066fc","SUR_TEST_001_1701702002975","Enter your First question"
"656de976e9b03d554c106702","SUR_TEST_002_1701702002975","Enter your Second question"
"656de976e9b03d554c106708","SUR_TEST_003_1701702002975","Are you planning to come back?"
"656de976e9b03d554c10670f","SUR_TEST_004_1701702002975","What type of device is available at home?"
"656de976e9b03d554c106715","SUR_TEST_005_1701702002975","Does the child have a quiet place to study?"
"656de976e9b03d554c10671b","SUR_TEST_006_1701702002975","Were you able to enroll your child in courses on Diksha?"
"656de976e9b03d554c106722","SUR_TEST_007_1701702002975","What are the challenges that you are facing in enrolment?"